{"boroughs":{"Bronx":{"alpha":0.915163529959994,"baseline":[{"fitted_speed_mph":14.49,"how":0,"median_speed_mph":14.892086029052734,"median_trip_min":11.92,"tti":1.3523,"v":2446.7169811320755,"x":0.4526},{"fitted_speed_mph":16.25,"how":1,"median_speed_mph":15.0,"median_trip_min":11.67,"tti":1.3425,"v":1553.9433962264152,"x":0.2874},{"fitted_speed_mph":17.42,"how":2,"median_speed_mph":15.385475158691406,"median_trip_min":11.8,"tti":1.3089,"v":1047.0754716981132,"x":0.1937},{"fitted_speed_mph":17.77,"how":3,"median_speed_mph":17.523178100585938,"median_trip_min":12.32,"tti":1.1492,"v":905.3396226415094,"x":0.1675},{"fitted_speed_mph":17.11,"how":4,"median_speed_mph":20.178241729736328,"median_trip_min":13.2,"tti":0.998,"v":1175.867924528302,"x":0.2175},{"fitted_speed_mph":15.74,"how":5,"median_speed_mph":18.547258377075195,"median_trip_min":13.5,"tti":1.0858,"v":1794.8301886792453,"x":0.332},{"fitted_speed_mph":13.38,"how":6,"median_speed_mph":14.558823585510254,"median_trip_min":14.55,"tti":1.3832,"v":3114.622641509434,"x":0.5761},{"fitted_speed_mph":10.9,"how":7,"median_speed_mph":11.245579719543457,"median_trip_min":15.15,"tti":1.7907,"v":5031.547169811321,"x":0.9307},{"fitted_speed_mph":10.16,"how":8,"median_speed_mph":10.92871379852295,"median_trip_min":14.82,"tti":1.8427,"v":5771.301886792453,"x":1.0675},{"fitted_speed_mph":11.82,"how":9,"median_speed_mph":12.014431953430176,"median_trip_min":14.13,"tti":1.6761,"v":4238.754716981132,"x":0.784},{"fitted_speed_mph":13.02,"how":10,"median_speed_mph":12.303191184997559,"median_trip_min":14.18,"tti":1.6368,"v":3348.169811320755,"x":0.6193},{"fitted_speed_mph":13.56,"how":11,"median_speed_mph":12.150927543640137,"median_trip_min":14.4,"tti":1.6573,"v":3001.867924528302,"x":0.5552},{"fitted_speed_mph":13.45,"how":12,"median_speed_mph":11.880512237548828,"median_trip_min":14.45,"tti":1.695,"v":3070.8867924528304,"x":0.568},{"fitted_speed_mph":13.09,"how":13,"median_speed_mph":11.422459602355957,"median_trip_min":14.48,"tti":1.763,"v":3303.943396226415,"x":0.6111},{"fitted_speed_mph":12.42,"how":14,"median_speed_mph":10.744041442871094,"median_trip_min":15.03,"tti":1.8743,"v":3771.9056603773583,"x":0.6977},{"fitted_speed_mph":12.34,"how":15,"median_speed_mph":10.434782981872559,"median_trip_min":15.48,"tti":1.9299,"v":3833.735849056604,"x":0.7091},{"fitted_speed_mph":12.36,"how":16,"median_speed_mph":10.079999923706055,"median_trip_min":15.85,"tti":1.9978,"v":3815.9056603773583,"x":0.7058},{"fitted_speed_mph":12.02,"how":17,"median_speed_mph":10.312664031982422,"median_trip_min":15.22,"tti":1.9527,"v":4080.9622641509436,"x":0.7548},{"fitted_speed_mph":12.66,"how":18,"median_speed_mph":11.535211563110352,"median_trip_min":13.7,"tti":1.7458,"v":3604.301886792453,"x":0.6667},{"fitted_speed_mph":13.3,"how":19,"median_speed_mph":12.636850357055664,"median_trip_min":12.97,"tti":1.5936,"v":3166.5471698113206,"x":0.5857},{"fitted_speed_mph":13.71,"how":20,"median_speed_mph":13.41313362121582,"median_trip_min":12.67,"tti":1.5014,"v":2906.1509433962265,"x":0.5375},{"fitted_speed_mph":14.11,"how":21,"median_speed_mph":13.951044082641602,"median_trip_min":12.45,"tti":1.4435,"v":2662.566037735849,"x":0.4925},{"fitted_speed_mph":14.2,"how":22,"median_speed_mph":14.610235214233398,"median_trip_min":12.37,"tti":1.3783,"v":2610.7169811320755,"x":0.4829},{"fitted_speed_mph":14.41,"how":23,"median_speed_mph":14.843879699707031,"median_trip_min":11.97,"tti":1.3566,"v":2494.4528301886794,"x":0.4614},{"fitted_speed_mph":15.88,"how":24,"median_speed_mph":14.89292049407959,"median_trip_min":11.48,"tti":1.3522,"v":1729.811320754717,"x":0.32},{"fitted_speed_mph":17.5,"how":25,"median_speed_mph":15.140939712524414,"median_trip_min":11.1,"tti":1.33,"v":1011.5094339622641,"x":0.1871},{"fitted_speed_mph":18.36,"how":26,"median_speed_mph":16.023120880126953,"median_trip_min":11.35,"tti":1.2568,"v":672.2075471698113,"x":0.1243},{"fitted_speed_mph":18.49,"how":27,"median_speed_mph":18.954721450805664,"median_trip_min":12.22,"tti":1.0624,"v":622.7358490566038,"x":0.1152},{"fitted_speed_mph":17.65,"how":28,"median_speed_mph":20.86383056640625,"median_trip_min":13.48,"tti":0.9652,"v":950.5471698113207,"x":0.1758},{"fitted_speed_mph":16.08,"how":29,"median_speed_mph":18.41663360595703,"median_trip_min":13.62,"tti":1.0935,"v":1636.377358490566,"x":0.3027},{"fitted_speed_mph":13.31,"how":30,"median_speed_mph":13.959183692932129,"median_trip_min":14.7,"tti":1.4426,"v":3158.698113207547,"x":0.5842},{"fitted_speed_mph":10.51,"how":31,"median_speed_mph":10.45572566986084,"median_trip_min":15.47,"tti":1.926,"v":5412.584905660377,"x":1.0011},{"fitted_speed_mph":9.92,"how":32,"median_speed_mph":10.209060668945312,"median_trip_min":15.23,"tti":1.9726,"v":6035.056603773585,"x":1.1163},{"fitted_speed_mph":11.6,"how":33,"median_speed_mph":11.322866439819336,"median_trip_min":14.57,"tti":1.7785,"v":4415.132075471698,"x":0.8166},{"fitted_speed_mph":12.83,"how":34,"median_speed_mph":11.720930099487305,"median_trip_min":14.42,"tti":1.7181,"v":3483.1132075471696,"x":0.6443},{"fitted_speed_mph":13.34,"how":35,"median_speed_mph":11.766990661621094,"median_trip_min":14.57,"tti":1.7114,"v":3136.3396226415093,"x":0.5801},{"fitted_speed_mph":13.26,"how":36,"median_speed_mph":11.663825035095215,"median_trip_min":14.7,"tti":1.7265,"v":3191.0188679245284,"x":0.5902},{"fitted_speed_mph":12.91,"how":37,"median_speed_mph":11.227723121643066,"median_trip_min":14.7,"tti":1.7936,"v":3424.811320754717,"x":0.6335},{"fitted_speed_mph":12.17,"how":38,"median_speed_mph":10.348993301391602,"median_trip_min":15.35,"tti":1.9459,"v":3962.8490566037735,"x":0.733},{"fitted_speed_mph":12.04,"how":39,"median_speed_mph":9.917570114135742,"median_trip_min":16.15,"tti":2.0305,"v":4059.566037735849,"x":0.7509},{"fitted_speed_mph":12.06,"how":40,"median_speed_mph":9.808382987976074,"median_trip_min":15.95,"tti":2.0531,"v":4048.4716981132074,"x":0.7488},{"fitted_speed_mph":11.56,"how":41,"median_speed_mph":9.882352828979492,"median_trip_min":15.5,"tti":2.0378,"v":4448.622641509434,"x":0.8228},{"fitted_speed_mph":12.12,"how":42,"median_speed_mph":11.058823585510254,"median_trip_min":13.98,"tti":1.821,"v":4002.566037735849,"x":0.7403},{"fitted_speed_mph":12.7,"how":43,"median_speed_mph":12.131584167480469,"median_trip_min":13.22,"tti":1.66,"v":3575.5471698113206,"x":0.6613},{"fitted_speed_mph":13.21,"how":44,"median_speed_mph":12.960000038146973,"median_trip_min":12.92,"tti":1.5539,"v":3225.9622641509436,"x":0.5967},{"fitted_speed_mph":13.54,"how":45,"median_speed_mph":13.76722240447998,"median_trip_min":12.73,"tti":1.4627,"v":3011.6603773584907,"x":0.557},{"fitted_speed_mph":13.62,"how":46,"median_speed_mph":14.434450149536133,"median_trip_min":12.82,"tti":1.3951,"v":2962.0188679245284,"x":0.5479},{"fitted_speed_mph":13.95,"how":47,"median_speed_mph":14.809768676757812,"median_trip_min":12.13,"tti":1.3598,"v":2761.396226415094,"x":0.5108},{"fitted_speed_mph":15.62,"how":48,"median_speed_mph":14.853273391723633,"median_trip_min":11.63,"tti":1.3558,"v":1856.9615384615386,"x":0.3435},{"fitted_speed_mph":17.24,"how":49,"median_speed_mph":14.993135452270508,"median_trip_min":11.3,"tti":1.3431,"v":1119.9807692307693,"x":0.2072},{"fitted_speed_mph":18.13,"how":50,"median_speed_mph":15.878571510314941,"median_trip_min":11.58,"tti":1.2682,"v":759.5961538461538,"x":0.1405},{"fitted_speed_mph":18.32,"how":51,"median_speed_mph":18.73501968383789,"median_trip_min":12.43,"tti":1.0749,"v":687.8846153846154,"x":0.1272},{"fitted_speed_mph":17.56,"how":52,"median_speed_mph":20.8138427734375,"median_trip_min":13.57,"tti":0.9675,"v":989.2307692307693,"x":0.183},{"fitted_speed_mph":15.99,"how":53,"median_speed_mph":18.25244903564453,"median_trip_min":13.75,"tti":1.1033,"v":1679.5576923076924,"x":0.3107},{"fitted_speed_mph":13.24,"how":54,"median_speed_mph":14.043343544006348,"median_trip_min":14.68,"tti":1.434,"v":3205.769230769231,"x":0.593},{"fitted_speed_mph":10.36,"how":55,"median_speed_mph":10.571830749511719,"median_trip_min":15.43,"tti":1.9049,"v":5560.9807692307695,"x":1.0286},{"fitted_speed_mph":9.73,"how":56,"median_speed_mph":10.390670776367188,"median_trip_min":14.97,"tti":1.9381,"v":6254.538461538462,"x":1.1569},{"fitted_speed_mph":11.39,"how":57,"median_speed_mph":11.551050186157227,"median_trip_min":14.27,"tti":1.7434,"v":4592.307692307692,"x":0.8494},{"fitted_speed_mph":12.65,"how":58,"median_speed_mph":11.86246109008789,"median_trip_min":14.4,"tti":1.6976,"v":3610.1153846153848,"x":0.6677},{"fitted_speed_mph":13.16,"how":59,"median_speed_mph":11.885379791259766,"median_trip_min":14.55,"tti":1.6943,"v":3258.846153846154,"x":0.6028},{"fitted_speed_mph":12.94,"how":60,"median_speed_mph":11.49357795715332,"median_trip_min":14.72,"tti":1.7521,"v":3403.3653846153848,"x":0.6295},{"fitted_speed_mph":12.58,"how":61,"median_speed_mph":11.157384872436523,"median_trip_min":14.85,"tti":1.8049,"v":3654.576923076923,"x":0.676},{"fitted_speed_mph":11.86,"how":62,"median_speed_mph":10.214938163757324,"median_trip_min":15.65,"tti":1.9714,"v":4203.2307692307695,"x":0.7774},{"fitted_speed_mph":11.85,"how":63,"median_speed_mph":9.944262504577637,"median_trip_min":16.18,"tti":2.0251,"v":4215.826923076923,"x":0.7798},{"fitted_speed_mph":11.7,"how":64,"median_speed_mph":9.72896957397461,"median_trip_min":16.07,"tti":2.0699,"v":4332.423076923077,"x":0.8013},{"fitted_speed_mph":11.21,"how":65,"median_speed_mph":9.7783784866333,"median_trip_min":15.68,"tti":2.0594,"v":4753.711538461538,"x":0.8793},{"fitted_speed_mph":11.78,"how":66,"median_speed_mph":10.89908218383789,"median_trip_min":14.12,"tti":1.8477,"v":4269.9807692307695,"x":0.7898},{"fitted_speed_mph":12.47,"how":67,"median_speed_mph":12.083806037902832,"median_trip_min":13.32,"tti":1.6665,"v":3735.3846153846152,"x":0.6909},{"fitted_speed_mph":13.03,"how":68,"median_speed_mph":13.03255844116211,"median_trip_min":12.92,"tti":1.5452,"v":3345.403846153846,"x":0.6188},{"fitted_speed_mph":13.25,"how":69,"median_speed_mph":13.65657